{
  "schema_version": 1,
  "candidate_id": "candidate-3077ac81",
  "created_at": "2026-08-13T05:00:00Z",
  "source": {
    "repository": "headroomlabs-ai/headroom",
    "sha": "3077ac81e8ef3ddefebbe308ea37a4e9bb2100e6",
    "branch": "main"
  },
  "artifact": {
    "name": "headroom-ai",
    "version": "0.36.0rc1",
    "filename": "headroom_ai-0.36.0rc1-py3-none-any.whl",
    "sha256": "sha256:aaaaaaaaaaaaaaaaaaaaaaaaaaaaaaaaaaaaaaaaaaaaaaaaaaaaaaaaaaaaaaaa",
    "size_bytes": 1048576,
    "media_type": "application/zip"
  },
  "runtime_payload_sha256": "sha256:bbbbbbbbbbbbbbbbbbbbbbbbbbbbbbbbbbbbbbbbbbbbbbbbbbbbbbbbbbbbbbbb",
  "build": {
    "repository": "headroomlabs-ai/headroom",
    "workflow": "candidate-artifact.yml",
    "run_id": 123456789,
    "run_attempt": 1,
    "commit_sha": "3077ac81e8ef3ddefebbe308ea37a4e9bb2100e6"
  },
  "rollout": {
    "schema_version": 1,
    "policy_version": "1",
    "channel": "stable",
    "registry_digest": "sha256:cccccccccccccccccccccccccccccccccccccccccccccccccccccccccccccccc",
    "snapshot_digest": "sha256:dddddddddddddddddddddddddddddddddddddddddddddddddddddddddddddddd",
    "unsafe_override": false,
    "qualification_eligible": true
  }
}
